{"analysis_lens":"ETF_STYLE","as_of_date":"2026-09-17","evidence_mode":"LIVE_PLUS_BACKTEST","factor_source":{"artifact_id":"market/us-equity-style.csv","date_column":"date","expected_sha256":"9781ec6d7c7b4528d835cde94aeb587ae4c131b950bb8b97d4773ae74af49270","expected_size_bytes":1005106,"factors":[{"column":"IWX","economic_family":"TOP_200_VALUE","effective_end":"2026-09-17","effective_start":"2009-09-29","factor_id":"IWX","raw_orthogonal":false,"redundancy_policy":"TRAIN_ONLY_NEAR_DUPLICATE_VIF_CONDITION_NUMBER_AND_PARSIMONY_GATES","return_source_id":"yahoo-adjusted-etf-daily","return_type":"TOTAL","selection_rationale":"IWX represents the declared TOP_200_VALUE family for the ETF_STYLE candidate universe using yahoo-adjusted-etf-daily; raw orthogonality is not assumed, and final inclusion is determined only by training-period validation, collinearity diagnostics, and the declared parsimony rule.","source_id":"yahoo-adjusted-etf-daily"},{"column":"IWY","economic_family":"TOP_200_GROWTH","effective_end":"2026-09-17","effective_start":"2009-09-29","factor_id":"IWY","raw_orthogonal":false,"redundancy_policy":"TRAIN_ONLY_NEAR_DUPLICATE_VIF_CONDITION_NUMBER_AND_PARSIMONY_GATES","return_source_id":"yahoo-adjusted-etf-daily","return_type":"TOTAL","selection_rationale":"IWY represents the declared TOP_200_GROWTH family for the ETF_STYLE candidate universe using yahoo-adjusted-etf-daily; raw orthogonality is not assumed, and final inclusion is determined only by training-period validation, collinearity diagnostics, and the declared parsimony rule.","source_id":"yahoo-adjusted-etf-daily"},{"column":"IWS","economic_family":"MID_CAP_VALUE","effective_end":"2026-09-17","effective_start":"2007-05-31","factor_id":"IWS","raw_orthogonal":false,"redundancy_policy":"TRAIN_ONLY_NEAR_DUPLICATE_VIF_CONDITION_NUMBER_AND_PARSIMONY_GATES","return_source_id":"yahoo-adjusted-etf-daily","return_type":"TOTAL","selection_rationale":"IWS represents the declared MID_CAP_VALUE family for the ETF_STYLE candidate universe using yahoo-adjusted-etf-daily; raw orthogonality is not assumed, and final inclusion is determined only by training-period validation, collinearity diagnostics, and the declared parsimony rule.","source_id":"yahoo-adjusted-etf-daily"},{"column":"IWP","economic_family":"MID_CAP_GROWTH","effective_end":"2026-09-17","effective_start":"2007-05-31","factor_id":"IWP","raw_orthogonal":false,"redundancy_policy":"TRAIN_ONLY_NEAR_DUPLICATE_VIF_CONDITION_NUMBER_AND_PARSIMONY_GATES","return_source_id":"yahoo-adjusted-etf-daily","return_type":"TOTAL","selection_rationale":"IWP represents the declared MID_CAP_GROWTH family for the ETF_STYLE candidate universe using yahoo-adjusted-etf-daily; raw orthogonality is not assumed, and final inclusion is determined only by training-period validation, collinearity diagnostics, and the declared parsimony rule.","source_id":"yahoo-adjusted-etf-daily"},{"column":"IWN","economic_family":"SMALL_CAP_VALUE","effective_end":"2026-09-17","effective_start":"2007-05-31","factor_id":"IWN","raw_orthogonal":false,"redundancy_policy":"TRAIN_ONLY_NEAR_DUPLICATE_VIF_CONDITION_NUMBER_AND_PARSIMONY_GATES","return_source_id":"yahoo-adjusted-etf-daily","return_type":"TOTAL","selection_rationale":"IWN represents the declared SMALL_CAP_VALUE family for the ETF_STYLE candidate universe using yahoo-adjusted-etf-daily; raw orthogonality is not assumed, and final inclusion is determined only by training-period validation, collinearity diagnostics, and the declared parsimony rule.","source_id":"yahoo-adjusted-etf-daily"},{"column":"IWO","economic_family":"SMALL_CAP_GROWTH","effective_end":"2026-09-17","effective_start":"2007-05-31","factor_id":"IWO","raw_orthogonal":false,"redundancy_policy":"TRAIN_ONLY_NEAR_DUPLICATE_VIF_CONDITION_NUMBER_AND_PARSIMONY_GATES","return_source_id":"yahoo-adjusted-etf-daily","return_type":"TOTAL","selection_rationale":"IWO represents the declared SMALL_CAP_GROWTH family for the ETF_STYLE candidate universe using yahoo-adjusted-etf-daily; raw orthogonality is not assumed, and final inclusion is determined only by training-period validation, collinearity diagnostics, and the declared parsimony rule.","source_id":"yahoo-adjusted-etf-daily"}],"interval_policy":{"available_through_anchor":"2026-09-17","currency":"USD","finality":"COMPLETE_SELECTED_SNAPSHOT","native_calendar":"SOURCE_LABELLED_DAILY","native_label_convention":"SOURCE_PUBLISHED_DAILY_LABEL","return_basis":"SOURCE_PUBLISHED","source_vintage":"9781ec6d7c7b4528d835cde94aeb587ae4c131b950bb8b97d4773ae74af49270"},"relative_path":"inputs/lenses/us-equity-style-factors.csv","risk_free_column":"BIL","schema_name":"portfolio-us-equity-style-returns","schema_version":"1"},"maximum_factor_staleness_days":0,"models":[{"as_of_date":"2026-09-17","constraint":"LONG_ONLY_SUM_TO_ONE","cost_coverage":"INCOMPLETE","cv_folds":3,"estimator":"STATIC_RBSA","factor_ids":["IWX","IWY"],"minimum_test_observations":20,"minimum_train_observations":40,"model_id":"p123-ai-factor-us-equity-style-01-static","parsimony_tolerance":"0.01","periods_per_year":252,"ridge_candidates":["0","0.000001","0.0001"],"series_id":"AI Factor [P123]","test_start":"2025-06-11","train_end":"2025-06-10"},{"as_of_date":"2026-09-17","constraint":"LONG_ONLY_SUM_TO_ONE","cost_coverage":"INCOMPLETE","cv_folds":3,"estimator":"STATIC_RBSA","factor_ids":["IWS","IWP"],"minimum_test_observations":20,"minimum_train_observations":40,"model_id":"p123-ai-factor-us-equity-style-02-static","parsimony_tolerance":"0.01","periods_per_year":252,"ridge_candidates":["0","0.000001","0.0001"],"series_id":"AI Factor [P123]","test_start":"2025-06-11","train_end":"2025-06-10"},{"as_of_date":"2026-09-17","constraint":"LONG_ONLY_SUM_TO_ONE","cost_coverage":"INCOMPLETE","cv_folds":3,"estimator":"STATIC_RBSA","factor_ids":["IWN","IWO"],"minimum_test_observations":20,"minimum_train_observations":40,"model_id":"p123-ai-factor-us-equity-style-03-static","parsimony_tolerance":"0.01","periods_per_year":252,"ridge_candidates":["0","0.000001","0.0001"],"series_id":"AI Factor [P123]","test_start":"2025-06-11","train_end":"2025-06-10"},{"as_of_date":"2026-09-17","constraint":"LONG_ONLY_SUM_TO_ONE","cost_coverage":"INCOMPLETE","cv_folds":3,"estimator":"STATIC_RBSA","factor_ids":["IWX","IWY","IWN","IWO"],"minimum_test_observations":20,"minimum_train_observations":80,"model_id":"p123-ai-factor-us-equity-style-04-static","parsimony_tolerance":"0.01","periods_per_year":252,"ridge_candidates":["0","0.000001","0.0001"],"series_id":"AI Factor [P123]","test_start":"2025-06-11","train_end":"2025-06-10"},{"as_of_date":"2026-09-17","constraint":"LONG_ONLY_SUM_TO_ONE","cost_coverage":"INCOMPLETE","cv_folds":3,"estimator":"STATIC_RBSA","factor_ids":["IWS","IWP","IWN","IWO"],"minimum_test_observations":20,"minimum_train_observations":80,"model_id":"p123-ai-factor-us-equity-style-05-static","parsimony_tolerance":"0.01","periods_per_year":252,"ridge_candidates":["0","0.000001","0.0001"],"series_id":"AI Factor [P123]","test_start":"2025-06-11","train_end":"2025-06-10"},{"as_of_date":"2026-09-17","constraint":"LONG_ONLY_SUM_TO_ONE","cost_coverage":"INCOMPLETE","cv_folds":3,"estimator":"STATIC_RBSA","factor_ids":["IWX","IWY","IWS","IWP","IWN","IWO"],"minimum_test_observations":20,"minimum_train_observations":120,"model_id":"p123-ai-factor-us-equity-style-06-static","parsimony_tolerance":"0.01","periods_per_year":252,"ridge_candidates":["0","0.000001","0.0001"],"series_id":"AI Factor [P123]","test_start":"2025-06-11","train_end":"2025-06-10"},{"as_of_date":"2026-09-17","constraint":"LONG_ONLY_SUM_TO_ONE","cost_coverage":"INCOMPLETE","cv_folds":3,"estimator":"STATIC_RBSA","factor_ids":["IWX","IWY"],"minimum_test_observations":20,"minimum_train_observations":40,"model_id":"qsi-us-equity-style-01-static","parsimony_tolerance":"0.01","periods_per_year":252,"ridge_candidates":["0","0.000001","0.0001"],"series_id":"QSI","test_start":"2024-02-06","train_end":"2024-02-05"},{"as_of_date":"2026-09-17","constraint":"LONG_ONLY_SUM_TO_ONE","cost_coverage":"INCOMPLETE","cv_folds":3,"estimator":"STATIC_RBSA","factor_ids":["IWS","IWP"],"minimum_test_observations":20,"minimum_train_observations":40,"model_id":"qsi-us-equity-style-02-static","parsimony_tolerance":"0.01","periods_per_year":252,"ridge_candidates":["0","0.000001","0.0001"],"series_id":"QSI","test_start":"2024-02-06","train_end":"2024-02-05"},{"as_of_date":"2026-09-17","constraint":"LONG_ONLY_SUM_TO_ONE","cost_coverage":"INCOMPLETE","cv_folds":3,"estimator":"STATIC_RBSA","factor_ids":["IWN","IWO"],"minimum_test_observations":20,"minimum_train_observations":40,"model_id":"qsi-us-equity-style-03-static","parsimony_tolerance":"0.01","periods_per_year":252,"ridge_candidates":["0","0.000001","0.0001"],"series_id":"QSI","test_start":"2024-02-06","train_end":"2024-02-05"},{"as_of_date":"2026-09-17","constraint":"LONG_ONLY_SUM_TO_ONE","cost_coverage":"INCOMPLETE","cv_folds":3,"estimator":"STATIC_RBSA","factor_ids":["IWX","IWY","IWN","IWO"],"minimum_test_observations":20,"minimum_train_observations":80,"model_id":"qsi-us-equity-style-04-static","parsimony_tolerance":"0.01","periods_per_year":252,"ridge_candidates":["0","0.000001","0.0001"],"series_id":"QSI","test_start":"2024-02-06","train_end":"2024-02-05"},{"as_of_date":"2026-09-17","constraint":"LONG_ONLY_SUM_TO_ONE","cost_coverage":"INCOMPLETE","cv_folds":3,"estimator":"STATIC_RBSA","factor_ids":["IWS","IWP","IWN","IWO"],"minimum_test_observations":20,"minimum_train_observations":80,"model_id":"qsi-us-equity-style-05-static","parsimony_tolerance":"0.01","periods_per_year":252,"ridge_candidates":["0","0.000001","0.0001"],"series_id":"QSI","test_start":"2024-02-06","train_end":"2024-02-05"},{"as_of_date":"2026-09-17","constraint":"LONG_ONLY_SUM_TO_ONE","cost_coverage":"INCOMPLETE","cv_folds":3,"estimator":"STATIC_RBSA","factor_ids":["IWX","IWY","IWS","IWP","IWN","IWO"],"minimum_test_observations":20,"minimum_train_observations":120,"model_id":"qsi-us-equity-sty